{
  "schema_version": "phase_field.vector-input.v1",
  "operation": "vector_evolve",
  "model_profile": "synthetic_tetragonal_quartic_v1",
  "units": "dimensionless",
  "dimension": 2,
  "cells": [
    2,
    2
  ],
  "parameters": {
    "a": -0.5,
    "b": 0.25,
    "c": 1.5,
    "g": 0.5,
    "epsilon": 1.0,
    "mobility": 1.0
  },
  "boundary_condition": "all_surface_voltage",
  "initial_condition": {
    "kind": "uniform",
    "values": [
      1.2756001604506857,
      0.0
    ]
  },
  "field_protocol": {
    "kind": "triangle",
    "direction": [
      1.0,
      0.0
    ],
    "amplitude": 0.8,
    "period": 24.0
  },
  "evolution": {
    "end": 48.0,
    "dt": 0.1,
    "max_steps": 600,
    "max_halvings": 6
  },
  "output": {
    "images": true
  },
  "source": {
    "kind": "synthetic_test",
    "reference": "Frozen experiments/ferroelectric_vector_poc V0.3; explicit uncalibrated reference scales for SI views"
  }
}
