{
  "schema_version": "phase_field.vector-input.v1",
  "operation": "vector_evolve",
  "model_profile": "synthetic_tetragonal_quartic_v1",
  "units": "dimensionless",
  "dimension": 3,
  "cells": [
    2,
    2,
    2
  ],
  "parameters": {
    "a": -0.5,
    "b": 0.25,
    "c": 1.5,
    "g": 0.5,
    "epsilon": 1.0,
    "mobility": 1.0
  },
  "boundary_condition": "all_surface_voltage",
  "initial_condition": {
    "kind": "uniform",
    "values": [
      0.8,
      0.1,
      0.1
    ]
  },
  "field_protocol": {
    "kind": "stairs",
    "times": [
      0.0,
      0.2,
      0.4
    ],
    "values": [
      [
        0.0,
        0.0,
        0.0
      ],
      [
        0.0,
        0.5,
        0.0
      ],
      [
        0.0,
        0.0,
        -0.5
      ]
    ]
  },
  "evolution": {
    "end": 0.6,
    "dt": 0.05,
    "max_steps": 32,
    "max_halvings": 6
  },
  "output": {
    "images": true
  },
  "source": {
    "kind": "synthetic_test",
    "reference": "Frozen experiments/ferroelectric_vector_poc V0.3; explicit uncalibrated reference scales for SI views"
  }
}
